,제목,내용,날짜,주소,nouns
0,러닝 후 무릎 통증 안쪽 아플 때 관리법,"러닝 후 무릎 통증 안쪽 아플 때 관리법살 빼기 좋은 계절 여름,겨울에 찐 살 어떻게든 빼보려고러닝을 시작했다가러닝 후 무릎 안쪽 통증 때문에고생을 좀 했었네요..요즘은 슬로우 러닝으로제 속도에 맞게 뛰고 있어요러닝, 절대 무리하지 마세요!제가 겪어보면서 느낀 것들그리고 통증이 있을 때물리치료 쌤이 말씀해 주신 관리법공유드릴 테니, 잘 관리하시길ㅠ러닝 후 무릎 안쪽 통증 원인!개인적으로 살 뺄 때 러닝은도움이 되는 운동이라 생각하지만무릎 관절에 무리 가는운동이라고도 생각해요그래서 러닝 후 무릎 통증 원인이여러가지가 있겠지만 가장 큰 원인은무게 증량 후 갑자기 뛰었을 때관절이 받는 충격 누적!+ 러닝 전 준비 운동 없이갑자기 뛰었을 때!준비 운동을 하지 않으면무릎 관절이 급격한 충격을흡수할 준비가 안되어 있기 때문에무릎 통증이 생긴다고 하셔서지금은 매번 러닝 전 준비 운동5분은 해주고 있어요!러닝 후 무릎 안쪽 통증 증상(+병원)저는 러닝 후 안쪽 통증이 있었을 때그냥 쉬면 괜찮아지겠지? 싶어서10일정도 휴식하면서 놔뒀는데나아지는 기미가 보이지 않더라구요;;걷는 동작만해도 통증이 느껴지고안쪽에 뭔가 찌르는 듯한 느낌도 있고뚝! 하는 소리도 나고 ㅠㅠ내일은 좀 괜찮아지겠지?근육통인가? 곧 괜찮아지겠지?라는 생각으로 그냥 두지 말고며칠 지속될 때는 정형외과 먼저방문하는게 좋은 것 같아요!방치하게 될 경우 부분 손상된 곳이점점 커지면서 파열이나심하면 관절이 잠기면서 관절염까지이어질 수 있다고도 하시더라고요러닝 후 무릎 안쪽 통증 물치쌤이 말해준 관리법안쪽 통증 증상은반월상연골 손상이었고이 경우 무릎 관리와장기적 근육 강화가 핵심!저는 일단 쌤이 해주신 조치로염증 제거를 위한 소염제 처방이렇게 받았고이후에는 휴식을 하며꾸준하게 관리를 하라고 하셨어요.(쪼그리는 운동 금지!)물치쌤이 말해준 관리법1.초기 붓기 및 염증 제거해 주기 위한 방법초기에 생긴 붓기 및 염증을제거해줘야 하는데 처음에는냉찜질을 하면 도움이 된다고 해요!냉찜질을 하루 2회 20분씩!이렇게 일주일 정도 꾸준히 해주면붓기는 가라 앉는다고 하더라고요가라 앉으면 끝이냐? 아니요!혈액 순환을 위해, 바닥에 누워서다리를 쇼파에 올리거나, 의자에 올려주고온찜질로 관리해야 한다고 하셨어요2.무릎 안정화를 위한 방법무릎은 한 번 손상되면100% 회복은 어려운 소모성 관절로다시 다치지 않도록무릎의 부담을 줄이고 안정화를 해야 해요!통증이 생기고 난 후에는가벼운 근력 강화를 위해의자에 앉아, 직각 다리 들기 운동을해주는 것도 도움이 되지만결국에는 일상 생활 동안 사용하는무릎의 부담을 줄여주는게 핵심!쌤이 권장해 주신 보호대를착용하고 다니는데집에 있던거랑 다르긴 하더라고요;사실, 러닝할 때도이런 러닝 보호대를 착용 했었지만무쓸모..결국 다치게 되더라고요;(저만 그런가요 ㅠㅠ?)그리고 집에서 사용하던 건무릎 전체를 감싸주는 거였는데저렴한 중국산 제품이라 그런지며칠 사용하니까 흘러내리면서무릎을 잘 잡아 주지도 않더라고요;그리고 고정 실리콘이라고 붙어 있는데그거 때문에 피부 발진 생기고..ㅠ(충격 받았는지 또, 물치 받으러 감..)물치 받으러 갔다가 쌤이왜 또 오셨냐고..관리 안해줬냐고물어보셔서 관리해주고 있는데보호대가 이상한 것 같다니까이때 하나 권장해 주시더라고요!지금 4주째 사용 중에 있는데한국산 제품이라 그런지피부 발진 이런 문제는 전혀 없었고이중 고정이 되서사용 중에 흘러내림이 없어서안정적이라는 느낌이 들었어요!그리고, 탄력적이다?무르비 받는 부담을 줄여준다?이런 느낌도 들었던 포인트가 있었는데전에 보호대 착용할 때는 몰랐지만이번에는 착용하면 가벼워지는 느낌?(착용 해보셔야 알아요 ㅠㅠ)그리고 무룹 전체를 감싸주지만뒤쪽이 뚫려서 오랫동안 착용해도그렇게 답답한 것도 없었어요안정감을 주고 부담을 확실하게줄이기 위해서 인지, 두께가 좀 있어낮에 착용하면 약간 더울 수 있는데사실, 다른거랑 다르게 안정감이 커서그게 큰 문제는 되지 않더라고요1가지 단점이 있다면 저는 찍찍이!너무 착 달라붙어 있어서 뗄 때힘을 줘야 뗄 수 있어요 ㅠㅠ(뭐..그만큼 고정이 잘 된다는 거니까여!)4주째 사용하면서잘 관리하고 있는 중이구요!지금은 좀 괜찮아져서고관절, 둔근 강화를 위해헬스장에 열심히 다니고 있어요(하루 30분은 꼭!)못 가면, 계단 걷기!절대, 무리하지 마시고할 수 있는 선에서 꾸준히 해봐요!+한 가지 관리 꿀팁은아침에 눈뜨자마자 온찜질 해주면하루가 편안해져요~우리 꾸준하게 관리해봐요!쌤이 말씀해 주신 건 요거에여!도움되시길!바르디홈 : 바르디홈건강한 삶을 선물하다. 바르디홈!m.site.naver.com#러닝후무릎통증 #러닝무릎통증 #러닝후안쪽무릎통증 #안쪽무릎통증",2025. 8. 20.,https://blog.naver.com/im1190/223974905897,"['러닝', '무릎', '통증', '안쪽', '관리', '법살', '빼기', '계절', '여름', '겨울', '러닝', '시작', '러닝', '무릎', '안쪽', '통증', '때문', '고생', '요즘', '슬로우', '러닝', '속도', '러닝', '절대', '통증', '물리치료', '말씀', '주신', '관리', '공유', '드릴', '관리', '러닝', '무릎', '안쪽', '통증', '원인', '개인', '러닝', '도움', '운동', '생각', '무릎', '관절', '무리', '운동', '생각', '러닝', '무릎', '통증', '원인', '여러가지', '가장', '원인', '무게', '증량', '갑자기', '관절', '충격', '누적', '러닝', '준비', '운동', '갑자기', '준비', '운동', '무릎', '관절', '충격', '흡수', '준비', '때문', '무릎', '통증', '지금', '매번', '러닝', '준비', '운동', '러닝', '무릎', '안쪽', '통증', '증상', '병원', '러닝', '안쪽', '통증', '그냥', '휴식', '기미', '보이지', '만해', '통증', '안쪽', '뭔가', '느낌', '소리', '내일', '근육통', '생각', '그냥', '며칠', '지속', '정형외과', '먼저', '방문', '방치', '경우', '부분', '손상', '점점', '파열', '관절', '관절염', '러닝', '무릎', '안쪽', '통증', '관리', '안쪽', '통증', '증상', '반월', '연골', '손상', '경우', '무릎', '관리', '장기', '근육', '강화', '핵심', '일단', '조치', '염증', '제거', '소염제', '처방', '이후', '휴식', '관리', '하라', '운동', '금지', '관리', '초기', '붓기', '염증', '제거', '주기', '방법', '초기', '붓기', '염증', '제거', '처음', '찜질', '도움', '찜질', '하루', '일주일', '정도', '붓기', '가라', '가라', '혈액', '순환', '위해', '바닥', '다리', '쇼파', '의자', '찜질', '관리', '무릎', '안정화', '방법', '무릎', '손상', '회복', '소모', '관절', '무릎', '부담', '안정화', '통증', '생기', '근력', '강화', '위해', '의자', '직각', '다리', '운동', '도움', '일상', '생활', '동안', '사용', '무릎', '부담', '핵심', '권장', '주신', '보호대', '착용', '사실', '러닝', '러닝', '보호대', '착용', '쓸모', '가요', '사용', '무릎', '전체', '중국산', '제품', '며칠', '사용', '무릎', '주지', '고정', '실리콘', '그거', '때문', '피부', '발진', '생기', '충격', '관리', '관리', '보호대', '하나', '권장', '지금', '사용', '국산', '제품', '피부', '발진', '문제', '전혀', '고이', '고정', '사용', '안정', '느낌', '탄력', '무르비', '부담', '느낌', '포인트', '보호대', '착용', '이번', '착용', '느낌', '착용', '무룹', '전체', '뒤쪽', '착용', '안정감', '부담', '위해', '인지', '두께', '착용', '약간', '사실', '안정감', '커서', '그게', '문제', '가지', '단점', '찍찍', '때힘', '고정', '사용', '관리', '중이', '지금', '서고', '관절', '강화', '위해', '헬스장', '하루', '가면', '계단', '걷기', '절대', '가지', '관리', '꿀팁', '아침', '찜질', '하루', '우리', '관리', '말씀', '주신', '도움', '선물', '러닝', '무릎', '통증']"
1,러닝 무릎 안쪽 통증 오른쪽 왼쪽 발생할때 원인,"러닝 무릎 안쪽 통증오른쪽 왼쪽 발생할때 원인안녕하세요!러닝 즐기시는 분들 중에서러닝 무릎 안쪽 통증 때문에고민인 분들 많으시죠?저도 한동안 오른쪽 관절이욱씬거려서 고생하다가,결국 왼쪽까지 아파지더라고요처음엔 그냥 피곤해서 그런가 보다 했는데점점 더 심해져서 걷는 것도힘들어질 때가 있었어요이대로는 안 되겠다 싶어서꾸준하게 방법을 찾아보며 관리를 해왔고지금은 나아졌답니다오늘은 저같이 고생하시는 분들을 위해제 경험과 대처법을 나눌게요재미있게 읽어주세요!러닝 무릎 안쪽 통증 증상:이런 신호가 온다면 주의1) 부종과 소리불편함이 시작될 때 나타나는가장 흔한 증상은 부종이에요.저는 오른쪽 관절부터 붓기 시작했는데요처음엔 대수롭지 않게 넘겼다가계단을 내려갈 때마다 통증이 심해지더니나중엔 왼쪽 무릎 안쪽 까지 불편해졌어요그때부터 관절에서뚝뚝 소리가 나기 시작했는데,이 소리가 많이 신경 쓰이더라고요.가만히 있어도 삐걱거림하고소리까지 더해져 불안해지기도 했어요부종과 소리 외에도 관절이 뻣뻣해지면서움직이는 게 점점 어려워졌는데요이런 신호가 온다면 가볍게 넘기지 마세요방치했다가 저처럼무릎 안쪽 통증으로 악화될 수 있답니다2) 근육 약화와 움직임 제한불편함이 오래되다 보면주변 근육이 약해지고걸음걸이가 어색해지기 시작해요저도 불편함이 심해지면서발을 내딛는 게 어정쩡해지고균형을 잡는 게 어렵더라고요관절 주위 근육이 약해지면 불편함이 점점심해지는 악순환에 빠질 수 있어요특히나 러닝을 즐기시는 분들은평소 관리를 더욱 신경 써야 합니다저는 이 시기를 잘못 넘겨서회복하기까지 더 오래 걸렸던 것 같아요러닝 무릎 안쪽 통증 원인:이런 것 들이 원인일 수 있어요1) 퇴행성 관절염가장 흔한 원인 중 하나는퇴행성 관절염이에요이 질환은 연골이 손상되면서관절에 염증을 발생시키는데요저처럼 꾸준히 러닝을 하다 보면연골이 반복적으로 마모되면서러닝 무릎 안쪽 통증이 생길 수 있는거죠최근에는 나이와 무관하게점점 많이 발생되는 추세인데요특히 여가활동으로 운동을 즐기는 분들,혹은 관절을 많이 쓰는 직업을 가진 분들이젊은 나이에도 겪는 경우가 많답니다2) 반월상 연골판 손상제 불편함의 주범은 바로부분적인 반월상 연골판 손상이었어요반월상 연골판은 연골의 체중을분산시키는 역할을 하는데,갑작스러운 방향 전환이나빠르게 회전할 때 손상되기 쉽답니다저도 러닝 무릎 안쪽 통증이처음엔 단순히 아픈 정도였는데,날이 갈수록 심해지고 관절이 붓고,가만히 있을 때도 욱씬거리더라고요특히 러닝을 즐기는 분들은이 부위에 손상이 생길 가능성이일반인보다 더 크기 때문에관리에 각별히 신경 써야 해요3) 슬개골 연골연화증무릎 앞쪽에주기적으로 충격이 가해지면연골이 약해지면서불편함이 생길 수 있어요반복적인 충격뿐만 아니라잘못된 자세나 적합하지 않은러닝화때문에 생길수도 있는데관절 앞쪽이 자주 시큰거린다면,슬개골 연골연화증을 생각해볼수 있어요무릎 안쪽 통증 발생한 경우치료 및 관리 방법위와같은 문제들이 발생하여불편함을 느끼고 계신 분들께제가 겪으면서 습득한공통적으로 도움이 될수있는실제 방법들을 소개해 드리려고 해요1) 혈액순환 치료통증을 관리하기 위해 먼저 해야 할 일은혈액순환을 개선하는 것이에요혈액순환이 원활하지 않으면관절절 및 주변 조직의 염증이 더 심해지고,회복 능력이 떨어져 회복이 느려지거든요저는 통증이 심해졌을 때 물리치료와원적외선 치료를 병행하면서혈액순환 개선에 중점을 두었어요물리치료를 통해주변의 뭉친 근육을 풀고 긴장된 조직을부드럽게 이완시키는 데 집중했고 동시에원적외선 치료를 통해서깊숙이 열을 전달해혈액순환이 더 잘 될수있도록꾸준하게 받았는데염증을 진정시키는데 큰 도움 되더라고요정말 신기해서 논문자료를 찾아보니관련 자료를 쉽게 찾아볼수가 있었어요병원 혈액순환 치료를 받으면서무릎 안쪽까지 따뜻해지는 느낌이 들면서,묵직했던 통증이점차 가벼워지는 걸 느낄 수 있었죠하지만 물리치료는 내원을 해야 하고,혈액순환 치료도 꾸준히 받으려면시간과 비용이 만만치 않더라고요그래서 집에서도비슷한 효과를 볼 수 있는 방법이 없을까?고민하던 끝에 선생님께 소개받고원적외선 무릎찜질기를 알아보게 되었어요2) 원적외선 무릎찜질기원적외선 찜질기는내원해서 받는 원적외선 치료와유사한 원리를 가지고 있다고 했어요집에서도 손쉽게 사용할 수 있다는 점이가장 큰 장점이었고,러닝 후 관절이 욱씬거리거나 시릴 때바로 사용할 수 있어서 정말 유용했어요찜질기의 원적외선 열은일반 온찜질보다 깊숙이 침투해불편함을 빠르게 줄이는데 효과적이에요혈액순환 치료를 받기 위해원적외선 물리치료를 일주일에2번이상 주기적으로 받으려 노력했는데실제로 너무 효과가 좋아서선생님께 여쭤보고 집에서도 관리할수있는원적외선 기기의 기준을 설명듣고열심히 찾아보고 사용하기 시작된거죠사실, 기준이란건 딴건 아니고원적외선 방출률이 90%가 넘는것들만알아보라고 하신 조언 이었어요그뒤로 는 러닝 전후 관절이 시리거나욱씬거릴 때 원적외선 찜질로 관리를 하면불편함이 확 주는걸 느낄수 있었어요특히 운동전 오른쪽, 왼쪽 무릎을 번갈아사용하면서 한결 부드러워지고 가벼워지는느낌을 받았어요제가 사용한건 무선형 이었는데,휴대성이 좋아서어디서든 쉽게 사용할 수 있었고,관절에 딱 밀착돼서 효과적으로열 전달되는걸 느낄수 있었어요원적외선 온찜질은 꾸준히 할수록더 큰 효과를 볼 수 있으니수시로 사용해보시는걸 권해드려요3) 주사치료만약 무릎 통증이 갑작스럽게 심해지거나,다른 방법으로는 효과가 미비할 때주사치료를 고려할 수도 있어요주사치료는 염증을 빠르게완화시키는 데 효과적이라급성 통증을 줄이는 데 유용하거든요저도 처음에 통증이 너무 심해서수차례 주사치료를 받았는데,받은 당일 뻐근함이 줄어들고며칠 후부터는 움직이기가 한결 편해졌어요다만,주사치료는 단기적인완화에 효과적이지만스테로이드 성분이 포함될수있어서반복적 사용시 부작용이 있을 수 있어요저도 주사치료를 응급처치로 활용했고,이후에는 꾸준한 원적외선 온찜질과스트레칭을 통해 근본적 관리를 이어갔어요4) 스트레칭과 근력 운동오른쪽 왼쪽 무릎 주변 근육을강화하는 건 통증 관리와 예방에 필수예요저는 매일 아침과 저녁으로스트레칭과 근력 운동을 꾸준히 했는데요,관절이이 안정되고 통증도 덜해졌어요좋은 스트레칭 소개벽 짚고 스쿼트벽에 기대어가볍게 관절을 굽혔다 펴는 동작을10회씩 3세트 진행하면 좋아요근력 운동은 처음엔 살짝 아프더라도꾸준히 하면 점차 안정되는걸 느낄 수 있을 거예요앉아서 오른쪽 왼쪽 무릎 펴기 운동이 스트레칭이 엄청 효율적인데요앉은채로 언제든 할수있어서저는 지금까지도 매일 반복하고 있어요앉은 상태에서 다리를 쭉 뻗어무릎이 굽지않도록 10초 유지하시고다리를 번갈아가며 20회 반복해 주세요5) 생활 속 관리 습관관절 건강을 지키기 위해서는생활 속에서 관절에 부담을 줄이는습관을 실천하는것이 중요해요운동전 몸을 충분히 풀어주는건 필수로 했고계단 오르내리기를 최대한 피하고쪼그려 앉는 자세를 줄이려고 노력했어요그리고 러닝화를 선택할 때는충격 흡수가 잘 되는 신발로골라야 부담을 덜 수 있어요마치며러닝 무릎 안쪽 통증은누구에게나 찾아올 수 있는 문제지만꾸준한 관리와 노력을 통해충분히 나아질 수 있어요저는 혈액순환 치료로서원적외선 물리치료와 함께평소에 수시로 원적외선 온찜질 병행하면서다시 러닝을 할 수 있을 정도로 회복했답니다러닝 무릎 통증으로 고민하시는 분들이라면,원적외선 온찜질과스트레칭을 꾸준히 실천해보세요변화를 느끼실 거예요긴 글 읽어주셔서 정말 감사드려요즐거운 러닝 하시길 응원할게요!",2024. 11. 30.,https://blog.naver.com/momoboli/223677939693,"['러닝', '무릎', '안쪽', '통증', '오른쪽', '왼쪽', '발생', '원인', '러닝', '러닝', '무릎', '안쪽', '통증', '때문', '고민', '오른쪽', '관절', '이욱', '씬거려', '고생', '왼쪽', '처음', '그냥', '런가', '점점', '이대', '방법', '관리', '금은', '오늘', '고생', '해제', '경험', '대처', '러닝', '무릎', '안쪽', '통증', '증상', '신호', '주의', '부종', '소리', '시작', '가장', '증상', '부종', '오른쪽', '관절', '붓기', '시작', '처음', '계단', '통증', '나중', '왼쪽', '무릎', '안쪽', '그때', '관절', '뚝뚝', '소리', '나기', '시작', '소리', '신경', '삐걱', '거림', '소리', '기도', '부종', '소리', '관절', '점점', '신호', '방치', '처럼', '무릎', '안쪽', '통증', '악화', '근육', '약화', '움직임', '제한', '주변', '근육', '걸음걸이', '시작', '균형', '관절', '주위', '근육', '점점', '악순환', '러닝', '평소', '관리', '더욱', '신경', '시기', '잘못', '러닝', '무릎', '안쪽', '통증', '원인', '원인', '행성', '관절염', '가장', '원인', '하나', '행성', '관절염', '질환', '연골', '손상', '관절', '염증', '발생', '처럼', '러닝', '연골', '반복', '모되', '면서', '러닝', '무릎', '안쪽', '통증', '최근', '나이', '무관', '점점', '발생', '여가', '활동', '운동', '관절', '직업', '나이', '경우', '반월', '연골', '손상', '바로', '부분', '반월', '연골', '손상', '반월', '연골', '연골', '체중', '분산', '역할', '방향', '전환', '회전', '손상', '러닝', '무릎', '안쪽', '통증', '처음', '정도', '갈수록', '관절', '욱씬', '거리', '러닝', '부위', '손상', '가능성', '일반인', '크기', '때문', '관리', '신경', '슬개골', '골연화증', '무릎', '앞쪽', '기적', '충격', '연골', '반복', '충격', '자세', '러닝', '때문', '관절', '앞쪽', '자주', '슬개골', '골연화증', '생각', '무릎', '안쪽', '통증', '발생', '경우', '치료', '관리', '방법', '문제', '발생', '습득', '공통', '도움', '실제', '방법', '소개', '혈액', '순환', '치료', '통증', '관리', '위해', '먼저', '혈액', '순환', '개선', '혈액', '순환', '면관', '절절', '주변', '조직', '염증', '회복', '능력', '회복', '통증', '물리치료', '원적외선', '치료', '병행', '혈액', '순환', '개선', '중점', '물리치료', '통해', '주변', '근육', '긴장', '조직', '이완', '집중', '동시', '원적외선', '치료', '전달', '혈액', '순환', '염증', '진정', '도움', '정말', '논문', '자료', '관련', '자료', '병원', '혈액', '순환', '치료', '무릎', '안쪽', '느낌', '통증', '점차', '물리치료', '혈액', '순환', '치료', '시간', '비용', '효과', '방법', '고민', '선생님', '소개', '원적외선', '무릎', '찜질', '원적외선', '무릎', '찜질', '원적외선', '찜질', '원적외선', '치료', '원리', '가지', '사용', '가장', '장점', '러닝', '관절', '욱씬', '거리', '거나', '바로', '사용', '정말', '찜질', '원적외선', '일반', '찜질', '침투', '효과', '혈액', '순환', '치료', '위해', '원적외선', '물리치료', '일주일', '이상', '기적', '노력', '실제', '효과', '선생님', '보고', '관리', '원적외선', '기기', '기준', '설명', '사용', '된거', '사실', '기준', '원적외선', '방출', '조언', '러닝', '전후', '관절', '욱씬거릴', '원적외선', '찜질', '관리', '는걸', '운동', '오른쪽', '왼쪽', '무릎', '번갈아', '사용', '한결', '느낌', '사용', '무선', '휴대', '어디', '서든', '사용', '관절', '밀착', '효과', '전달', '원적외선', '찜질', '효과', '사용', '주사', '치료', '만약', '무릎', '통증', '다른', '방법', '효과', '치료', '고려', '수도', '주사', '치료', '염증', '완화', '효과', '급성', '통증', '처음', '통증', '차례', '치료', '당일', '며칠', '움직', '이기', '한결', '다만', '치료', '기적', '완화', '효과', '스테로이드', '성분', '포함', '반복', '사용', '부작용', '치료', '응급처치', '활용', '이후', '원적외선', '찜질', '스트레칭', '통해', '근본', '관리', '스트레칭', '근력', '운동', '오른쪽', '왼쪽', '무릎', '주변', '근육', '통증', '관리', '예방', '필수', '매일', '아침', '저녁', '스트레칭', '근력', '운동', '관절', '이이', '안정', '통증', '스트레칭', '개벽', '스쿼트', '관절', '동작', '세트', '진행', '근력', '운동', '처음', '살짝', '점차', '안정', '오른쪽', '왼쪽', '무릎', '운동', '스트레칭', '효율', '언제', '지금', '매일', '반복', '상태', '다리', '무릎', '유지', '다리', '번갈아', '반복', '생활', '관리', '습관', '관절', '건강', '생활', '관절', '부담', '습관', '실천', '운동', '필수', '최대한', '피하', '자세', '노력', '러닝', '선택', '충격', '흡수', '신발', '부담', '마치', '러닝', '무릎', '안쪽', '통증', '누구', '문제', '관리', '노력', '통해', '혈액', '순환', '치료', '원적외선', '물리치료', '평소', '원적외선', '찜질', '병행', '다시', '러닝', '정도', '러닝', '무릎', '통증', '고민', '원적외선', '찜질', '스트레칭', '실천', '변화', '요긴', '정말', '감사', '러닝', '응원']"
